{
  "captured_at": "2026-04-26T23:05:00Z",
  "metadata": {
    "collector": "charon",
    "fixture_generation_version": "v1",
    "fixture_source": "crates/stygian-charon/docs/examples/fingerprint-snapshot-v1-browser.json",
    "target": "example-browser"
  },
  "mode": "Browser",
  "schema_version": "1.0.0",
  "signals": {
    "accept_language": "en-US,en;q=0.8",
    "features": {
      "cookies_enabled": true,
      "webdriver": false,
      "webgl_debug_renderer_info": false
    },
    "headers": {
      "accept": "text/html,application/xhtml+xml",
      "sec-fetch-site": "none"
    },
    "platform": "MacIntel",
    "screen": {
      "device_pixel_ratio": 2.0,
      "height": 982,
      "width": 1512
    },
    "timezone": "America/Los_Angeles",
    "tls": {
      "ja3_hash": "b1b1b1b1b1b1b1b1b1b1b1b1b1b1b1b1",
      "ja4": "t13d1516h2_8daaf6152771_02713d6af862"
    },
    "user_agent": "Mozilla/5.0 (Macintosh; Intel Mac OS X 10_15_7) AppleWebKit/605.1.15",
    "webgl": {
      "renderer": "ANGLE (Intel, Intel(R) Iris(TM) Plus Graphics, OpenGL 4.1)",
      "vendor": "Google Inc. (Intel)"
    }
  },
  "snapshot_id": "snapshot-browser-0001"
}
