{
  "schema_version": "1.0.0",
  "snapshot_id": "snapshot-http-0001",
  "mode": "Http",
  "captured_at": "2026-04-26T23:00:00Z",
  "signals": {
    "user_agent": "Mozilla/5.0 (Windows NT 10.0; Win64; x64) AppleWebKit/537.36",
    "accept_language": "en-US,en;q=0.9",
    "platform": "Win32",
    "timezone": "America/New_York",
    "headers": {
      "accept": "text/html,application/xhtml+xml",
      "sec-fetch-site": "none"
    },
    "features": {
      "cookies_enabled": true,
      "webdriver": false
    },
    "screen": {
      "width": 1920,
      "height": 1080,
      "device_pixel_ratio": 1.0
    },
    "webgl": null,
    "tls": {
      "ja3_hash": "a0a0a0a0a0a0a0a0a0a0a0a0a0a0a0a0",
      "ja4": "t13d1516h2_8daaf6152771_02713d6af862"
    }
  },
  "metadata": {
    "collector": "charon",
    "target": "example-http"
  },
  "legacy_user_agent": "Mozilla/5.0 (Windows NT 10.0; Win64; x64) AppleWebKit/537.36",
  "legacy_ja3_hash": "a0a0a0a0a0a0a0a0a0a0a0a0a0a0a0a0"
}
